{
  "schemaVersion": "codex-question-candidate-v1",
  "candidateId": "CQ-MATH-0006",
  "subject": "math",
  "topicCode": "M-FUNC-001",
  "topicTitle": "基本初等函数",
  "designedDifficulty": "basic",
  "questionType": "single_choice",
  "prompt": "已知函数 f(x)=log_3(x+8)，请选择它的定义域。",
  "options": [
    {
      "id": "A",
      "text": "按真数约束，定义域为 (-8,+∞)"
    },
    {
      "id": "B",
      "text": "按真数约束，定义域为 [-8,+∞)"
    },
    {
      "id": "C",
      "text": "按真数约束，定义域为 (-∞,-8)"
    },
    {
      "id": "D",
      "text": "忽略真数约束时会误判定义域为 R"
    }
  ],
  "correctAnswer": "A",
  "explanation": "真数必须大于 0，所以 x+8>0，即 x>-8。",
  "knowledgeTags": [
    "基本初等函数",
    "对数函数",
    "定义域"
  ],
  "syllabusVersion": "2025",
  "questionPlan": {
    "schemaVersion": "subject-practice-question-plan-v1",
    "policyVersion": "subject-practice-question-plan-policy-v1",
    "subject": "math",
    "topicId": 69,
    "topicTitle": "基本初等函数",
    "productionCellId": 16,
    "targetDifficulty": "basic",
    "taskFamily": "elementary_function_direct_property",
    "planTemplate": "math_elementary_function_relation_v1",
    "representationType": "text",
    "renderConstraints": {
      "questionType": "single_choice",
      "requiresImage": false,
      "externalContextAllowed": false,
      "pureMathStemOnly": true,
      "forbidGenericFunctionListClassification": true,
      "forbidElementaryFunctionExternalContextWrapper": true,
      "requireMediumElementaryConcreteExpressionRelation": false,
      "requireBasicElementarySingleObjectSingleTarget": true,
      "singlePropertyTargetContractVersion": "math-basic-elementary-single-property-target-v1",
      "allowedSinglePropertyTargets": [
        "function_value",
        "domain",
        "range",
        "monotonicity"
      ],
      "requiredSinglePropertyTarget": "domain",
      "requiredElementaryFunctionClass": "logarithmic",
      "forbidCrossPropertyDistractors": true,
      "forbidBasicElementaryEquationSolve": true,
      "forbidBasicElementaryOrderingChain": true,
      "forbidBasicElementaryParameterInference": true,
      "forbidBasicElementaryTargetProfileInflation": true,
      "maxFunctionPropertyStack": 1,
      "maxEnumeratedConditions": 1,
      "maxFunctionObjects": 1,
      "maxIndependentRelations": 1,
      "finalAnswerShape": "one_direct_elementary_function_property_or_value",
      "preferredPromptSkeletons": [
        "给出一个指数/对数/幂/根式函数表达式，只求定义域、单调性或一个函数值中的一项；题干与解析均不得提及未考查性质",
        "给出 log_a x、a^x、x^n 或一个简单根式的具体参数，只判断一个直接性质；不要用“无需判断其他性质”等否定措辞列出其他性质"
      ]
    },
    "budget": {
      "maxPlanRepairs": 2,
      "maxCandidateRepairs": 1
    },
    "scenarioContract": {
      "schemaVersion": "subject-practice-scenario-contract-v1",
      "policyVersion": "subject-practice-scenario-diversity-shadow-v2-multi-evidence-status",
      "stage": "shadow_only_thresholds_not_frozen",
      "scenarioMode": "abstract",
      "scenarioFamilyId": "math_abstract_function_object",
      "scenarioDomain": "pure_mathematics",
      "scenarioEntity": "function_object",
      "scenarioAction": "logarithmic:domain",
      "informationForm": "symbolic_text",
      "scenarioFingerprint": "scenario-f58859f8f49e317553ee",
      "contextNecessity": "not_applicable",
      "requiredInformationFields": [],
      "solverRelevantFields": [],
      "surface": {
        "zhEntity": "",
        "enEntity": "",
        "zhSetting": "",
        "enSetting": "",
        "cueTokens": []
      },
      "plausibility": {
        "externalContextForbidden": true
      },
      "sourceIsolation": {
        "officialQuestionContentUsed": false,
        "reversibleSourceFieldsUsed": false,
        "selectionBasis": "controlled_catalog_and_sealed_ordinal_only"
      }
    },
    "evidenceSlots": [
      {
        "id": "e1",
        "type": "elementary_function_object",
        "role": "exponential_logarithmic_power_or_radical_expression",
        "independentGroup": "e1"
      },
      {
        "id": "e2",
        "type": "domain_order_or_graph_condition",
        "role": "domain_range_monotonicity_order_interval_or_graph_intersection",
        "independentGroup": "e1"
      }
    ],
    "hypotheses": [],
    "reasoningSteps": [
      {
        "id": "r1",
        "operation": "identify_elementary_function_domain_or_expression",
        "inputs": [
          "e1"
        ],
        "output": "function_frame"
      },
      {
        "id": "r2",
        "operation": "apply_domain_order_or_graph_condition",
        "inputs": [
          "function_frame",
          "e2"
        ],
        "output": "intermediate_relation"
      }
    ],
    "quantitativeRelations": [
      {
        "id": "q1",
        "type": "elementary_function_relation_round_trip",
        "expression": "domain, order, graph, inverse, or inequality relation checks the selected result",
        "variables": [
          "x",
          "log",
          "exp",
          "power"
        ],
        "roundTripCheck": true
      }
    ],
    "misconceptionTargets": [
      "ignoring domain restrictions",
      "comparing logs or powers by decimal guessing only",
      "medium elementary-function item as a generic function-list classification without a given expression relation",
      "hard elementary-function item without a second bound or parameter relation"
    ],
    "answerDerivation": [
      "use the elementary-function object and one visible relation to determine the answer"
    ],
    "uniquenessConditions": [
      "only one option satisfies all visible elementary-function relations"
    ]
  },
  "localizations": {
    "zh": {
      "prompt": "已知函数 f(x)=log_3(x+8)，请选择它的定义域。",
      "options": [
        {
          "id": "A",
          "text": "按真数约束，定义域为 (-8,+∞)"
        },
        {
          "id": "B",
          "text": "按真数约束，定义域为 [-8,+∞)"
        },
        {
          "id": "C",
          "text": "按真数约束，定义域为 (-∞,-8)"
        },
        {
          "id": "D",
          "text": "忽略真数约束时会误判定义域为 R"
        }
      ],
      "explanation": "真数必须大于 0，所以 x+8>0，即 x>-8。",
      "knowledgeTags": [
        "基本初等函数",
        "对数函数",
        "定义域"
      ]
    },
    "en": {
      "prompt": "For f(x)=log_3(x+8), choose its domain.",
      "options": [
        {
          "id": "A",
          "text": "From the argument constraint, the domain is (-8,+∞)"
        },
        {
          "id": "B",
          "text": "From the argument constraint, the domain is [-8,+∞)"
        },
        {
          "id": "C",
          "text": "From the argument constraint, the domain is (-∞,-8)"
        },
        {
          "id": "D",
          "text": "Ignoring the argument constraint would incorrectly give domain R"
        }
      ],
      "explanation": "The logarithm argument must be positive, so x+8>0 and x>-8.",
      "knowledgeTags": [
        "Elementary functions"
      ]
    }
  },
  "generationMetadata": {
    "origin": "codex_dual_session_pilot",
    "generatorTaskId": "pilot-30-generator-task-2026-09-15",
    "model": "gpt-5",
    "promptVersion": "codex-library-generator-v1",
    "createdAt": "2026-09-15T10:00:00.000Z",
    "family": "elementary_bounded",
    "seed": 16,
    "generatorVersion": "math-elementary-local-generator-v6-formula-evidence",
    "scopeId": "math-basic-elementary-rotation-v1:logarithmic:domain",
    "deterministicVerification": {
      "solver": {
        "solverVersion": "math-elementary-direct-property-solver-v1",
        "taskFamily": "elementary_function_direct_property",
        "status": "verified",
        "parsed": true,
        "functionKind": "logarithmic",
        "canonicalTask": {
          "model": {
            "kind": "logarithmic",
            "base": 3,
            "offset": 8
          },
          "propertyTarget": "domain",
          "evaluationInput": null
        },
        "optionVerdicts": [
          {
            "optionId": "A",
            "verdict": "true",
            "property": "domain",
            "reasonCode": "math_solver_domain_matches",
            "semanticValue": {
              "kind": "interval",
              "lower": -8,
              "upper": "infinity",
              "lowerClosed": false,
              "upperClosed": false
            }
          },
          {
            "optionId": "B",
            "verdict": "false",
            "property": "domain",
            "reasonCode": "math_solver_domain_mismatch",
            "semanticValue": {
              "kind": "interval",
              "lower": -8,
              "upper": "infinity",
              "lowerClosed": true,
              "upperClosed": false
            }
          },
          {
            "optionId": "C",
            "verdict": "false",
            "property": "domain",
            "reasonCode": "math_solver_domain_mismatch",
            "semanticValue": {
              "kind": "interval",
              "lower": "-infinity",
              "upper": -8,
              "lowerClosed": false,
              "upperClosed": false
            }
          },
          {
            "optionId": "D",
            "verdict": "false",
            "property": "domain",
            "reasonCode": "math_solver_domain_mismatch",
            "semanticValue": {
              "kind": "interval",
              "lower": "-infinity",
              "upper": "infinity",
              "lowerClosed": false,
              "upperClosed": false
            }
          }
        ],
        "trueOptionIds": [
          "A"
        ],
        "selectedOptionId": "A",
        "uniqueAnswer": true,
        "agreesWithGenerator": true,
        "evidenceBoundary": "prompt_and_visible_options_only",
        "providerImpact": "none_no_provider_call",
        "productionGateImpact": "none_shadow_only",
        "reasonCodes": [
          "math_solver_domain_matches",
          "math_solver_domain_mismatch"
        ],
        "verificationScope": {
          "scopeVersion": "math-elementary-direct-property-verification-scope-v1",